date,tags
2011-08-16 13:00:05 GMT,"Bellatrix Lestrange, Fanfiction Rating: Teen, Hurt/Comfort, Narcissa Malfoy, Non-Canon, Fanfiction"
2011-08-11 04:30:05 GMT,"Merlin, Merthur, Hurt/comfort, Don't mind me I'll just give myself a neck massage over here., Becca writes Merthur, Camping queue!"
2011-07-31 22:32:05 GMT,"angst, hurt/comfort, james potter, lily evans, lily potter, harry potter, harry potter fanfiction, fanfic, fic rec, harry potter fic rec, fanfic rec"
2011-07-29 04:36:05 GMT,"!Rated M, !Complete, !FF.net, angst, hurt/comfort, Baby Fic, !Multi-chaptered"
2011-07-27 09:43:00 GMT,"kurt hummel, sue sylvester, glee, fanfic, hurt/comfort, story"
2011-07-27 03:32:47 GMT,"!Rated PG, !lj, !Complete, Drama, hurt/comfort, season 3"
2011-07-21 17:34:00 GMT,"Gerita, Angst, GermanyxItaly, Human Nature, Hurt/comfort"
2011-07-16 19:05:00 GMT,"fanfiction, glee, hevans, hurt/comfort, kum, kurt, kurtsie, more rumours, romance, rumours, sam, sam and kurt, sam leaving, sammites, whatever else i can tag it with :L, justnobodygirl, cathalftw"
2011-07-08 05:12:57 GMT,"Fanfiction, Glee, Faberry, Faberryfic, Hurt/comfort, Prompt Fill, FF.net"
2011-07-05 16:15:03 GMT,"Sherlock, john, fanart, comic, hurt/comfort"
2011-06-22 02:23:02 GMT,"!Rated PG13, !Complete, !lj, hurt/comfort, +Cameron"
2011-06-18 15:54:00 GMT,"Jemma, Jenny, Emma, fanfic, hurt/comfort, Hand aufs Herz"
2011-06-14 06:14:13 GMT,"sad, fanfiction, inception, hurt/comfort"
2011-06-05 15:28:33 GMT,"mark owen, jason orange, hurt/comfort, take that"
2011-05-23 01:32:00 GMT,"Glee, fanfiction, angst, hurt/comfort, self harm, Kurt Hummel, Finn Hudson"
2011-05-02 00:27:00 GMT,"klaine, angst, hurt/comfort, recovery, nikkithedead, glee fanfiction, rape fiction"
2011-04-28 04:02:00 GMT,"fringe,, polivia,, fringe fic, hurt/comfort, post-ep"
2011-04-22 02:38:21 GMT,"Degrassi, Fitz, Clare, Tragedy, Hurt/Comfort, Fanfiction"
2011-04-16 09:37:24 GMT,"PG-13, Hurt/Comfort, Angst, fic, Snafu/Sledge"
2011-04-02 03:28:00 GMT,"flashfiction365, hurt/comfort, prompt, prose, simple thoughts, creative writing"
2011-03-15 09:58:26 GMT,"girl!Sam, Wincest, hurt/comfort, whiskering"
2011-03-14 01:37:52 GMT,"Tim/Kon, Hurt/Comfort, Slight Angst, Fanfic fail *sigh*"
2011-03-09 22:52:11 GMT,"SUPERNATURAL, HURT/COMFORT, FICS"
2011-03-02 14:34:59 GMT,"Dark!Dean/Fallen!Cas, 'The End', Hurt/Comfort"
2011-02-27 06:49:00 GMT,"drabble, flashfiction365, hurt/comfort, prompt, robots, say it again, vignette, prose, scifi"
2011-01-28 18:45:46 GMT,"fanfiction recs, Sherlock, hurt/comfort, John Watson, someone needs hugs"
2011-01-17 11:40:26 GMT,"Glee, fanfiction, Kurt, Wes, hurt/comfort, fic rec"
2011-01-15 20:09:00 GMT,"30 Seconds To Mars, drama, hurt/comfort, jared leto, ofc, rated R, rated X"
